{
  "$schema": "https://json-schema.org/draft/2020-12/schema",
  "$id": "https://no-swipe.local/schemas/account-profile.schema.json",
  "title": "No Swipe Douyin Account Profile",
  "type": "object",
  "additionalProperties": false,
  "required": [
    "schema_version", "profile_id", "platform", "account_ref", "revision",
    "name", "positive_topics", "negative_topics", "boundary_guidance",
    "created_at", "updated_at"
  ],
  "properties": {
    "schema_version": {"const": "1.0.0"},
    "profile_id": {"type": "string", "minLength": 1},
    "platform": {"const": "douyin"},
    "account_ref": {"type": "string", "minLength": 1},
    "revision": {"type": "integer", "minimum": 1},
    "name": {"type": "string", "minLength": 1},
    "selection_mode": {"enum": ["include", "exclude_only"]},
    "audience": {"type": "array", "uniqueItems": true, "items": {"type": "string", "minLength": 1}},
    "positive_topics": {"type": "array", "uniqueItems": true, "items": {"type": "string", "minLength": 1}},
    "high_priority_topics": {"type": "array", "uniqueItems": true, "items": {"type": "string", "minLength": 1}},
    "negative_topics": {"type": "array", "uniqueItems": true, "items": {"type": "string", "minLength": 1}},
    "excluded_creator_types": {"type": "array", "uniqueItems": true, "items": {"type": "string", "minLength": 1}},
    "boundary_guidance": {"type": "array", "items": {"type": "string", "minLength": 1}},
    "content_rules": {
      "type": "object", "additionalProperties": false,
      "required": ["minimum_like_count", "below_minimum_behavior", "recent_evidence_sources", "recent_definition"],
      "properties": {
        "short_video_max_duration_seconds": {"type": "integer", "minimum": 1},
        "short_video_behavior": {"enum": ["skip", "not_interested_or_skip"]},
        "minimum_like_count": {"type": "integer", "minimum": 0},
        "below_minimum_behavior": {"enum": ["skip", "skip_unless_recent"]},
        "recent_evidence_sources": {"type": "array", "minItems": 1, "uniqueItems": true, "items": {"enum": ["feed_published_at", "creator_profile_video_list"]}},
        "recent_definition": {"type": "string", "minLength": 1}
      },
      "dependentRequired": {
        "short_video_max_duration_seconds": ["short_video_behavior"],
        "short_video_behavior": ["short_video_max_duration_seconds"]
      }
    },
    "creator_rules": {
      "type": "object", "additionalProperties": false,
      "required": ["high_relevance"],
      "properties": {
        "high_relevance": {
          "type": "object", "additionalProperties": false,
          "required": ["follower_count_min", "follower_count_max", "require_stable_recent_likes", "stability_definition", "evidence_source"],
          "properties": {
            "follower_count_min": {"type": "integer", "minimum": 0},
            "follower_count_max": {"type": "integer", "minimum": 0},
            "require_stable_recent_likes": {"type": "boolean"},
            "stability_definition": {"type": "string", "minLength": 1},
            "evidence_source": {"const": "creator_profile"}
          }
        }
      }
    },
    "classification": {
      "type": "object",
      "additionalProperties": false,
      "required": ["high_match_count"],
      "properties": {"high_match_count": {"type": "integer", "minimum": 1}}
    },
    "created_at": {"type": "string", "format": "date-time"},
    "updated_at": {"type": "string", "format": "date-time"}
  },
  "allOf": [
    {
      "if": {"properties": {"selection_mode": {"const": "exclude_only"}}, "required": ["selection_mode"]},
      "then": {"properties": {"negative_topics": {"minItems": 1}}},
      "else": {"properties": {"positive_topics": {"minItems": 1}}}
    }
  ]
}
